{
  "draft_id": "8T7",
  "title": "今天锂矿概念持续走高，锂板块大涨｜盘面热点：午后锂矿概念持续走高，盛新锂能涨停，此前融捷股份、江特电机、科达制造…",
  "duration_sec": 90,
  "structure_template": "standard",
  "segments": [
    {
      "time": "0:00-0:03",
      "role": "hook",
      "say": "今天整个市场绿了",
      "visual": [
        "配图:大盘分时图"
      ]
    },
    {
      "time": "0:03-0:08",
      "role": "hook",
      "say": "但有一个板块疯涨！",
      "visual": [
        "配图:锂矿板块涨幅居前",
        "特效:zoom-in"
      ]
    },
    {
      "time": "0:08-0:15",
      "role": "hook",
      "say": "锂矿概念今天集体爆发，盛新锂能直接涨停，融捷股份、江特电机、科达制造也都封板了。到底发生了什么？",
      "visual": [
        "配图:盛新锂能涨停K线",
        "配图:融捷股份涨停K线"
      ]
    },
    {
      "time": "0:15-0:22",
      "role": "argument_1",
      "say": "先看盘面：",
      "visual": [
        "贴纸:数据说话"
      ]
    },
    {
      "time": "0:22-0:30",
      "role": "argument_1",
      "say": "今天上证指数跌了0.25%，创业板指跌了1.31%",
      "visual": [
        "配图:三大指数涨跌对比图"
      ]
    },
    {
      "time": "0:30-0:38",
      "role": "argument_1",
      "say": "但锂矿板块一枝独秀，锂板块涨了8.15%，能源金属涨了6.93%",
      "visual": [
        "配图:锂板块涨幅",
        "配图:能源金属涨幅"
      ]
    },
    {
      "time": "0:38-0:45",
      "role": "argument_1",
      "say": "盛新锂能、融捷股份、江特电机、科达制造涨停，永兴材料、西藏珠峰逼近涨停",
      "visual": [
        "配图:涨停个股名单"
      ]
    },
    {
      "time": "0:45-0:52",
      "role": "argument_2",
      "say": "消息面也有催化：",
      "visual": [
        "贴纸:消息速递"
      ]
    },
    {
      "time": "0:52-1:02",
      "role": "argument_2",
      "say": "Mysteel数据显示，今天电池级碳酸锂早盘价较昨日涨了350元/吨，中间价报172250元/吨",
      "visual": [
        "配图:碳酸锂价格走势图"
      ]
    },
    {
      "time": "1:02-1:15",
      "role": "argument_2",
      "say": "这已经是近期连续上涨了，说明需求端确实在回暖",
      "visual": [
        "配图:新能源汽车销量图"
      ]
    },
    {
      "time": "1:15-1:25",
      "role": "turn",
      "say": "现在问题来了：这波锂矿行情是超跌反弹，还是反转的开始？",
      "visual": [
        "配图:锂矿板块历史K线"
      ]
    },
    {
      "time": "1:25-1:30",
      "role": "cta",
      "say": "你手上有没有锂矿票？评论区聊聊！",
      "visual": [
        "贴纸:评论互动"
      ],
      "cta_hint": "评论区聊聊"
    }
  ],
  "cta": {
    "type": "comment_reply",
    "position": "ending",
    "phrasing": "你手上有没有锂矿票？评论区聊聊！"
  },
  "source": {
    "topic": "今天锂矿概念持续走高，锂板块大涨｜盘面热点：午后锂矿概念持续走高，盛新锂能涨停，此前融捷股份、江特电机、科达制造…",
    "data_sources": [
      "财联社",
      "Mysteel"
    ]
  },
  "compliance": {
    "status": "pass",
    "warnings": [],
    "scanned_at": "2026-04-24T15:56:50+08:00",
    "scanner_version": "v0.1.2"
  }
}
